GROUP,CLUSTER,KEYWORDS,VOLUME_MO,TOP_KEYWORD,TOP_VOLUME
Chat,Live chat,486,4670,add chat to website,260
Chat,WhatsApp,77,800,add whatsapp button to website,40
Chat,Chatbot,39,630,add chatbot to website,50
Chat,Video calling,13,180,how to add video calling to your website,70
Reviews,Google reviews,105,1960,add google reviews to website,260
Reviews,Review widget,108,820,add facebook reviews to website,70
Reviews,Trustpilot,5,80,add trustpilot to website,20
Social,Instagram,604,5580,how to add website link in instagram post,720
Social,TikTok,134,1910,how to add website link to tiktok,210
Social,Facebook,258,1390,add facebook feed to website,70
Social,YouTube,278,1040,should i add youtube videos to my website moz,30
Social,Twitter/X,306,640,add twitter feed to website,40
Social,Social buttons,115,550,add a share button to website,20
Social,Pinterest,115,410,add pinterest feed to website,40
Social,LinkedIn,96,260,add linkedin button to website,20
Analytics,Google Analytics,374,4600,how to add google analytics to website,480
Analytics,Facebook Pixel,78,640,how to add facebook pixel to website,50
Analytics,Heatmap,6,70,add hotjar to website,20
Analytics,Other tracking,16,30,how to add a linkedin pixel to your website,20
SEO,Keywords,149,9570,how to add keywords to shopify website,720
SEO,Submit to search,553,8510,add website to google,480
SEO,SEO general,69,1540,add seo to website,720
SEO,Schema/Structured,72,1220,how to add schema markup to website,260
SEO,Meta tags,128,1050,add meta tags to website,170
SEO,Backlinks,26,380,how to add a backlink to my website,50
SEO,Sitemap,66,310,how to add sitemap to wordpress website,30
SEO,SERP features,1,140,how to add serp features to my website,140
Payment,PayPal,328,1720,add paypal link to website,50
Payment,Payment gateway,184,1650,add bitcoin payment to website,90
Payment,Booking/Appt,125,1430,add calendly to wordpress website using elementor,590
Payment,Buy/Cart,152,620,add ecommerce to website,90
Payment,Stripe,39,300,add stripe checkout to website,20
Payment,Donate,82,270,add a donation button to your website,20
Payment,Price table,2,10,add pricing table to website,10
Forms,Survey/Quiz,109,610,how to add google form to website,140
Forms,Popup,139,460,add popup to website,50
Forms,Newsletter/Email,165,450,add a mailchimp signup form to website,20
Forms,Contact form,49,320,add contact form to canva website,20
Forms,Form builder,3,10,how to add form builder app on shopify website,10
Maps,Google Maps,334,1700,add google map to website,110
Maps,Store locator,8,50,add store locator to website,20
Media,Audio/Podcast,328,1450,can you add music to canva website,30
Media,Video player,247,1210,add video conferencing to your website,90
Media,PDF embed,184,890,how to add a pdf to website,30
Media,Background,107,350,add background image to website,20
Media,News feed,75,300,add rss news feed to website,40
Media,Image gallery,107,220,add photo gallery to website,20
Media,Slider/Carousel,7,20,add image slider to website,20
Security,SSL/HTTPS,281,1420,how to add ssl certificate to website,140
Security,CAPTCHA,67,700,add captcha to website,90
Security,Privacy/GDPR,47,350,add a privacy policy to my website,20
Security,Login/Auth,81,310,add login page to website,20
Security,Cookie consent,15,140,add a cookie consent message to your website,20
Content,Blog,502,2050,add blog to website,70
Content,Site search,208,1240,how to add search words to website,140
Content,Hyperlinks,183,1040,how do you add a link to a website,70
Content,Translation,76,890,add google translate to website,70
Content,Favicon,144,780,how to add a favicon to a website,90
Content,Text to image,21,400,website to add text to pictures,210
Content,Filtering,3,330,how to add filtering on my website,320
Content,Countdown timer,62,230,add a countdown to website,20
Content,Comments,42,160,add a comment section to your website,20
Content,Testimonials,33,120,add testimonials to website,40
Content,Flash/Legacy,125,110,how to add flash games to your website,20
Content,Breadcrumb/Nav,10,30,how to add breadcrumbs to website,20
Content,Accordion/FAQ,16,10,how to add faq section to wedding website,10
Content,Notification bar,1,0,add hello bar to website,0
Monetize,Google Ads,298,3830,how to add ads to your website,390
Monetize,Affiliate,76,270,add website to amazon affiliate,20
Design,Logo,172,890,add a logo to website html,20
Design,Font/Icons,74,560,add a font file to a divi website,390
Design,CSS/Style,33,200,how to add css in website.com builder,170
Design,Dark mode,22,130,add dark mode to website,20
Design,Preloader,15,50,add a preloader to website,10
Design,Back to top,4,10,how to add back to top button to website,10
Design,Modal,1,0,add modal to my website,0
Feature,Gambling/Game,151,1590,blackjack easy embed to add to website,1000
Feature,AI widget,36,1120,add spiritual ai to website,260
Feature,Calendar,278,1120,how to add calendar to squarespace website,30
Feature,Embed/Code,241,1000,how to add html to godaddy website,50
Feature,Real estate,66,390,add idx to website,30
Feature,Calculator,58,260,add calculator to website,20
Feature,Weather,83,240,add weather forecast to website,20
Feature,Visitor counter,25,160,add a visitor counter to my website,20
Feature,QR code,15,110,add qr code to website,20
Feature,Push notif,19,80,add push notifications to website,20
Feature,Accessibility,7,60,add accessibility to website,20
Feature,Stock/Finance,22,40,add stock ticker to website,20
Feature,Events,8,30,how to add eventbrite to website,20
Feature,Job board,6,20,add job board to website,20
Feature,Membership,9,20,add paywall to website,20
Feature,Social proof,2,20,add social proof to website,20
Feature,Restaurant menu,4,10,add restaurant menu to website,10
Feature,A/B test,1,0,add vwo smart code to your website,0
Platform,Wix,706,2110,add a banner to wix website,20
Platform,WordPress,740,1970,how to add a video to wordpress website,50
Platform,GoDaddy,304,770,how to add a form to godaddy website,30
Platform,Shopify,159,700,add a page to shopify website,20
Platform,Squarespace,170,660,how to add vcard to squarespace website for download,210
Platform,Canva,37,450,can you add buttons to canva website,30
Platform,IIS/Windows,97,230,add certificate to iis website,20
Platform,HTML/static,125,230,add cms to html website,20
Platform,Blogger,32,100,add blogspot to website,50
Platform,HubSpot,14,30,add hubspot form to website,20
Platform,Weebly,108,30,weebly how to add gif to website,20
Platform,Notion,1,20,notion add link to website,20
Platform,Drupal,6,10,how to add modules to drupal website,10
Platform,Next.js/React,9,0,add a forum to next.js website,0
Platform,Joomla,32,0,add clickable website to member profile membership pro joomla,0
Platform,Webflow,5,0,add star rating to webflow website,0
UserAction,Home screen,521,11580,how to add website to home screen,1900
UserAction,Bookmarks/Favorites,676,11210,how to add website in favorites,480
UserAction,Desktop/Dock,420,10550,how to add a website shortcut to desktop,1600
UserAction,Profile/bio link,168,2380,how to add website link to facebook post,170
UserAction,Browser/Chrome UI,30,820,how to add website shortcut to google chrome homepage android,320
Other,Other,12586,36440,online translate audio from website to text add on,1000
