Keyword,Intent,Volume,Keyword Difficulty,CPC (USD),SERP Features
code review service,"Informational, Commercial",140,32,4.88,"Sitelinks, AI Overview, Video, Discussions and forums, Related searches"
code review services,"Informational, Commercial",140,33,5.58,"Sitelinks, AI Overview, People also ask, Discussions and forums, Related searches, Ads bottom"
code review as a service,"Informational, Commercial",110,1,4.88,"Sitelinks, AI Overview, Video, Discussions and forums, Related searches"
ai-powered code review services for backend development reviews,"Informational, Commercial",70,35,0.00,"Sitelinks, AI Overview, Video, Video carousel, Discussions and forums, Related searches"
chat-driven code review services secure integration options.,Commercial,70,27,0.00,"Sitelinks, AI Overview, Video, Video carousel, Related searches"
secure code review services,"Informational, Commercial",70,0,0.00,"Sitelinks, AI Overview, Video, Related searches"
source code review services,"Informational, Commercial",70,3,0.00,"Sitelinks, AI Overview, Related searches, Ads bottom, Ads middle"
building code review services,,40,,0.00,
source code review service,"Informational, Commercial",40,21,0.00,"Sitelinks, AI Overview, Video, Discussions and forums, Related searches"
secure source code review services,,30,,0.00,
affordable ai code review services for small development teams,,20,,0.00,
affordable automated code review services for startups,,20,,0.00,
ai code review service with best reviews,,20,,0.00,
angular code review service,,20,,0.00,
aws code review service,,20,,0.00,
cape cod appliance service reviews,,20,,0.00,
champion tree service cape cod reviews,,20,,0.00,
customer reviews of code review notification services,,20,,0.00,
elder services of cape cod reviews,,20,,0.00,
unbiased code review services,,20,,0.00,
website code review services,,20,,0.00,
affordable automated code review services for startups 2025,,10,,0.00,
ai code review service github integration,,10,,0.00,
ai code review services,,10,,0.00,
ai code review services compared by cost and features,,10,,0.00,
ai no-code workbench reviews financial services,,10,,0.00,
automated code review tools micro-service architectures support,,10,,0.00,
best agentic code review tools for python services.,,10,,0.00,
best ai code review services for startups and scale-ups,,10,,0.00,
code review service provider,,10,,0.00,
compare pricing and plans of code review automation services,,10,,0.00,
full code advance directive services expert review consultation,,10,,0.00,
pull request code review as a service,,10,,0.00,
reviews of ai-powered code review services for backend development,,10,,0.00,
secure source code review services uae,,10,,0.00,
source code review service in singapore,,10,,0.00,
source-code-review-services,,10,,0.00,
/overview most reliable ai code review services for continuous integration,,0,,0.00,
ai code review multi-language monorepo cross-service dependency pull request,,0,,0.00,
ai code review service,,0,,0.00,
ai code review service best reviews,,0,,0.00,
ai code review service security vulnerabilities go,,0,,0.00,
ai code review services per-seat pricing,,0,,0.00,
ai-powered code review services for backend development,,0,,0.00,
aicpa peer review level of service codes,,0,,0.00,
assassin key services are secure code review and,,0,,0.00,
assassin key services are secure code review and testing,,0,,0.00,
automated code review service,,0,,0.00,
bathtub refinishing services reviews near zip code 10280,,0,,0.00,
best agentic code review tools for python services,,0,,0.00,
best agentic code review tools for python services 2025,,0,,0.00,
best ai code review services for startups and scale-ups 2025,,0,,0.00,
best chat-driven code review services for open source projects.,,0,,0.00,
best secure code review services,,0,,0.00,
best smart contract code review services,,0,,0.00,
best-reviewed roofing service near my zip code,,0,,0.00,
best-reviewed roofing service near zip code,,0,,0.00,
building code review service,,0,,0.00,
building project code review services,,0,,0.00,
cape cod commercial linen service reviews,,0,,0.00,
cape cod human services reviews,,0,,0.00,
cape cod junk removal & cleanout services reviews,,0,,0.00,
cape cod tree service reviews,,0,,0.00,
clarion book review service and book review discount codes,,0,,0.00,
code 3 security and protection services reviews,,0,,0.00,
code 4 security services 2 reviews fort collins co 80525,,0,,0.00,
code lab international services pvt ltd reviews,,0,,0.00,
code logic software services reviews,,0,,0.00,
code peer review services,,0,,0.00,
code review and audit services,,0,,0.00,
code review and software audit services,,0,,0.00,
code review as a service techcrunch,,0,,0.00,
code review notification services,,0,,0.00,
code review services estonia,,0,,0.00,
code review services inc,,0,,0.00,
code review services uk,,0,,0.00,
code review team service,,0,,0.00,
code review team services,,0,,0.00,
code review visual studio team services,,0,,0.00,
code reviews services,,0,,4.88,
code reviews services provider company,,0,,0.00,
comparison of code review notification services and pricing,,0,,0.00,
cryptocurrency code review services,,0,,0.00,
custom code review service,,0,,0.00,
customer reviews of home cleaning services in area code 89129,,0,,0.00,
electrical code review services,,0,,0.00,
enterprise-grade chat-driven code review services features,,0,,0.00,
enterprise-grade chat-driven code review services features.,,0,,0.00,
evaluating code review notification services for productivity gains,,0,,0.00,
expert reviews on low-code ai integration services,,0,,0.00,
fairway lawn & tree service-cape cod harwich reviews,,0,,0.00,
fiverr no-code support services user reviews,,0,,0.00,
github code review service,,0,,0.00,
health care service review decision reason codes,,0,,0.00,
how to sony tv service menu mode reset code review,,0,,0.00,
identogo texas fingerprint service code for personal review,,0,,0.00,
identogo texas fingerprint service code form personal review,,0,,0.00,
iphone imei code services reviews,,0,,0.00,
leading smart contract code review services,,0,,0.00,
level of service codes peer review,,0,,0.00,
microsoft team services code review,,0,,0.00,
mobile code review services,,0,,0.00,
most reliable ai code review services for continuous integration,,0,,0.00,
municipal code review services,,0,,0.00,
municipality code review services,,0,,0.00,
online code review service,,0,,0.00,
pci compliance code review service,,0,,0.00,
peer review level of service codes,,0,,0.00,
personal review service code form,,0,,0.00,
php code review service,,0,,0.00,
pre service review not completed code,,0,,0.00,
professional code review services,,0,,0.00,
pull request code review service,,0,,0.00,
pullrequest code review as a service,,0,,0.00,
pullrequest code review service worth it,,0,,0.00,
python code review services,,0,,0.00,
qr code review generator for field services,,0,,0.00,
report review service code,,0,,0.00,
residential code review services,,0,,0.00,
review of ai-powered code review services,,0,,0.00,
review of best free short code sms services,,0,,0.00,
review of best free short code sms services 2018,,0,,0.00,
reviews for htc internet services in 29576 zip code,,0,,0.00,
reviews of ai no-code workbench for financial services,,0,,0.00,
secure code review services in india,,0,,0.00,
security code review services,,0,,0.00,
service line reason code suspending for membership review,,0,,0.00,
services of an architect code review,,0,,0.00,
services to reduce code-review cycles dbt,,0,,0.00,
software code review service,,0,,0.00,
software code review services,,0,,0.00,
sony tv service menu mode code review,,0,,0.00,
tax code review service,,0,,0.00,
team services code review,,0,,0.00,
top ai-powered code review service,,0,,0.00,
top considerations for pricing ai code review services,,0,,0.00,
top-rated chat code review services for developer collaboration,,0,,0.00,
top-rated chat code review services for improving developer collaboration.,,0,,0.00,
typescript code review services for enterprise applications,,0,,0.00,
unison tax code review service,,0,,0.00,
verizon service in cape cod reviews,,0,,0.00,
visual studio team services automated code review,,0,,0.00,
visual studio team services code review,,0,,0.00,
zm qr code services reviews,,0,,0.00,
