Keyword,Intent,Volume,Trend,Keyword Difficulty,CPC (USD),Competitive Density,SERP Features,Number of Results
plausible analytics,Navigational,1300,"0.37,0.46,0.68,0.52,0.52,0.84,1.00,0.68,0.68,0.84,0.68,0.84",62,7.75,0.26,"Sitelinks, Video, Video carousel, Knowledge panel, Related searches, Ads bottom",41800000
plausible analytics pricing,"Navigational, Transactional",210,"0.04,0.03,0.02,0.04,0.04,0.05,1.00,0.05,0.03,0.03,0.04,0.02",27,10.03,0.16,"Sitelinks, Video, People also ask, Related searches",36200000
plausible analytics open source version site size limits,,70,"0.36,1.00",,0.00,0.00,,
plausible vs fathom analytics,"Informational, Commercial",70,"1.00,1.00,0.44,0.55",0,0.00,0.00,"Sitelinks, AI Overview, Video, Discussions and forums, Related searches",59500
google analytics plausible ai traffic detection comparison,,40,1.00,,0.00,0.00,,
plausible analytics real-time dashboard update interval,Navigational,40,"1.00,0.60,0.20,0.00",8,0.00,0.00,"Sitelinks, AI Overview, Video, Related searches",36000000
plausible vs google analytics,"Informational, Commercial",40,"0.22,0.22,0.22,0.22,0.55,1.00,0.77,0.55,0.22,0.22,0.33,0.44",21,0.00,0.11,"Sitelinks, AI Overview, Video carousel, Discussions and forums, Related searches",41100000
google analytics vs plausible,,30,"1.00,0.75,0.75,0.50,0.50,1.00,0.50,0.50,0.50,0.50,0.50,0.50",,0.00,0.33,,
google analytics vs plausible comparison 2026,,30,1.00,,0.00,0.00,,
plausible analytics news,,30,"1.00,0.00,0.00,0.00,0.00",,0.00,0.00,,
plausible analytics privacy-friendly,,30,"0.20,1.00",,0.00,0.00,,
plausible analytics revenue,,30,"0.00,0.22,0.22,0.22,0.22,0.22,0.55,0.22,0.22,0.22,1.00,0.22",,0.00,0.33,,
plausible web analytics,"Navigational, Commercial",30,"0.17,0.17,1.00,0.17,0.17,0.17,0.17,0.17,0.17,0.17,0.17,0.17",24,10.03,0.50,"Sitelinks, Video, Related searches, Ads top, Ads bottom",25200000
what is plausible analytics,,30,"0.44,1.00,0.22,0.22,0.22,0.22,0.22,0.22,0.22,0.22,0.22,0.22",,0.00,0.33,,
fathom analytics vs plausible,,20,"1.00,1.00,1.00,1.00,1.00,1.00,1.00,1.00,1.00,1.00,1.00,1.00",,0.00,0.66,,
plausible analytics alternative,,20,"0.40,0.40,0.40,0.40,0.40,0.60,0.40,0.40,0.40,1.00,0.40,0.40",,0.00,0.66,,
plausible analytics api,,20,"0.20,0.20,1.00,0.20,0.40,0.40,0.40,0.40,0.40,0.40,0.40,0.40",,0.00,0.33,,
plausible analytics docker,,20,"1.00,1.00,1.00,1.00,1.00,1.00,1.00,1.00,1.00,1.00,0.00,1.00",,0.00,0.00,,
plausible analytics free,,20,"1.00,1.00,1.00,1.00,1.00,1.00,1.00,1.00,1.00,1.00,1.00,1.00",,0.00,0.33,,
plausible analytics gdpr compliance,,20,"0.33,1.00",,0.00,0.00,,
plausible analytics github,,20,"1.00,1.00,1.00,1.00,1.00,1.00,1.00,1.00,1.00,1.00,1.00,1.00",,0.00,0.05,,
plausible analytics license,,20,1.00,,0.00,0.00,,
plausible analytics privacy-first,,20,1.00,,0.00,0.00,,
plausible analytics real-time dashboard update frequency,,20,"1.00,0.75,0.25,0.25",,0.00,0.00,,
plausible analytics reddit,,20,"0.50,1.00,0.25,0.25,1.00,0.25,0.25,0.50,0.50,0.50,0.50,0.50",,0.00,0.33,,
plausible analytics review,,20,"0.66,0.66,0.66,0.66,0.66,1.00,0.66,0.66,0.66,0.66,0.33,0.66",,0.00,0.33,,
plausible analytics self hosted,,20,"1.00,1.00,1.00,1.00,1.00,1.00,1.00,1.00,1.00,1.00,1.00,1.00",,0.00,0.21,,
plausible analytics vs fathom,,20,"1.00,1.00,1.00,1.00,1.00,1.00,0.00,1.00,1.00,0.00,1.00,1.00",,0.00,0.36,,
plausible analytics vs google analytics,,20,"1.00,1.00,1.00,1.00,1.00,1.00,1.00,1.00,1.00,1.00,1.00,1.00",,0.00,0.33,,
plausible analytics wordpress,,20,"1.00,1.00,1.00,1.00,1.00,1.00,1.00,1.00,1.00,1.00,1.00,1.00",,0.00,0.33,,
plausible google analytics,,20,"1.00,1.00,1.00,1.00,1.00,1.00,1.00,1.00,1.00,1.00,1.00,1.00",,0.00,0.23,,
plausible vs simple analytics,,20,"1.00,1.00,1.00,1.00,1.00,1.00,1.00,0.00,1.00,1.00,0.00,1.00",,0.00,0.00,,
simple analytics vs plausible,,20,"1.00,1.00,1.00,1.00,1.00,1.00,1.00,0.00,1.00,1.00,1.00,1.00",,0.00,0.04,,
fathom vs plausible no-cookie analytics,,10,1.00,,0.00,0.00,,
plausible analytics accuracy compared to cookies,,10,1.00,,0.00,0.00,,
plausible analytics affiliate program 2025,,10,"1.00,1.00,0.00,0.00,0.00,0.00",,0.00,0.00,,
plausible analytics affiliate program commission,,10,"0.20,0.80,1.00,0.00,0.00,0.00,0.00",,0.00,0.00,,
plausible analytics alternatives,,10,"0.25,0.00,0.00,0.00,0.00,0.00,0.25,0.00,1.00,1.00,0.00",,0.00,0.00,,
plausible analytics current version,,10,"0.00,1.00",,0.00,0.00,,
plausible analytics founded year bootstrapped arr,,10,1.00,,0.00,0.00,,
plausible analytics gdpr compliant,,10,"0.00,0.00,0.00,1.00,0.00,0.00,0.33",,0.00,0.00,,
plausible analytics latest stable version,,10,"0.50,1.00",,0.00,0.00,,
plausible analytics news december 2025,,10,"1.00,0.00",,0.00,0.00,,
plausible analytics no cookies by default,,10,"1.00,0.00,0.00,0.50,0.00",,0.00,0.00,,
plausible analytics pricing free,,10,1.00,,0.00,0.00,,
plausible analytics privacy,,10,1.00,,0.00,0.00,,
plausible analytics privacy first,,10,"0.00,1.00",,0.00,0.00,,
plausible analytics privacy focused,,10,1.00,,0.00,0.00,,
plausible analytics privacy friendly,,10,"0.50,1.00",,0.00,0.00,,
plausible analytics privacy-focused,,10,"0.00,1.00",,0.00,0.00,,
plausible analytics privacy-friendly gdpr compliant,,10,"0.00,1.00,0.00,1.00,1.00",,0.00,0.00,,
plausible analytics unique visitors ip user agent,,10,1.00,,0.00,0.00,,
plausible analytics unique visitors ip user-agent,,10,1.00,,0.00,0.00,,
plausible analytics unique visitors method ip user-agent,,10,1.00,,0.00,0.00,,
plausible import google analytics,,10,"0.00,1.00,1.00,0.00,1.00,0.00,1.00,0.00,0.00,0.00,1.00,0.00",,0.00,0.33,,
plausible vs fathom analytics comparison,,10,"1.00,0.00,1.00,0.00",,0.00,0.00,,
analytical procedures plausible relationship,,0,"0.00,0.00,0.00,0.00,0.00,0.00,0.00,0.00,0.00,0.00,0.00,0.00",,0.00,0.00,,
analytical procedures plausible relationships,,0,"0.00,0.00,0.00,0.00,0.00,0.00,0.00,0.00,0.00,0.00,0.00,0.00",,0.00,0.00,,
cloudflare analytics vs plausible,,0,"0.00,0.00,0.00,0.00",,0.00,0.00,,
google analytics alternative plausible,,0,"0.00,0.00,0.00,0.00,0.00,0.00,0.00,0.00,0.00,0.00,0.00",,0.00,0.00,,
google tag manager vs website header adding plausible analytics,,0,0.00,,0.00,0.00,,
google tag manager vs website header for adding plausible analytics,,0,0.00,,0.00,0.00,,
google tag manager vs website header plausible analytics implementation,,0,"1.00,0.00",,0.00,0.00,,
is plausible analytics free,,0,"0.00,0.00,0.00,0.00,0.00,0.00,0.00,0.00,0.00,1.00,0.00,1.00",,0.00,0.33,,
loamly vs google analytics vs plausible comparison,,0,0.00,,0.00,0.00,,
plausible analytic,,0,0.00,,0.00,0.00,,
plausible analytics affiliate program,,0,"0.00,0.00,0.00,0.00,0.00,0.00,0.00",,0.00,0.00,,
plausible analytics affiliate program commission 2025,,0,"0.00,0.00,0.00,0.00,0.00",,0.00,0.00,,
plausible analytics affiliate program recurring commission,,0,"0.00,0.00,0.00,0.00,0.00,0.00",,0.00,0.00,,
plausible analytics api documentation,,0,"0.00,0.00,0.00",,0.00,0.00,,
plausible analytics arr 2024,,0,"0.00,0.00,0.00,0.00,0.00,0.00,0.00,0.00",,0.00,0.00,,
plausible analytics blog,,0,0.00,,0.00,0.00,,
plausible analytics cookie less gdpr compliant,,0,0.00,,0.00,0.00,,
plausible analytics cookie-less gdpr compliant,,0,"0.00,0.00",,0.00,0.00,,
plausible analytics cookieless gdpr compliant,,0,"0.00,0.00,0.00,0.00",,0.00,0.00,,
plausible analytics current mrr 2024,,0,0.00,,0.00,0.00,,
plausible analytics current mrr 2025,,0,0.00,,0.00,0.00,,
plausible analytics data studio,,0,"0.00,0.00,0.00,0.00,0.00,0.00,0.00,0.00,0.00,0.00,0.00,0.00",,0.00,0.00,,
plausible analytics default port,,0,0.00,,0.00,0.00,,
plausible analytics documentation,,0,"0.00,0.00",,0.00,0.00,,
plausible analytics eu hosted gdpr compliant,,0,"0.00,0.00",,0.00,0.00,,
plausible analytics features pricing,,0,0.00,,0.00,0.00,,
plausible analytics free plan,,0,"1.00,0.00,0.00,0.00,0.00,0.00,0.00",,0.00,0.00,,
plausible analytics free tier,,0,0.00,,0.00,0.00,,
plausible analytics funding,,0,"0.00,0.00,0.00,0.00",,0.00,0.00,,
plausible analytics gdpr compliant eu hosting,,0,"0.00,0.00",,0.00,0.00,,
plausible analytics how it tracks unique visitors ip user-agent,,0,0.00,,0.00,0.00,,
plausible analytics news november 2025,,0,"0.00,0.00,0.00",,0.00,0.00,,
plausible analytics news today,,0,"0.00,0.00,0.00,0.00,0.00",,0.00,0.00,,
plausible analytics no cookies gdpr compliant,,0,"1.00,1.00,0.00,0.00,0.00",,0.00,0.00,,
plausible analytics no cookies gdpr compliant documentation,,0,"0.00,0.00",,0.00,0.00,,
plausible analytics open source license agpl,,0,0.00,,0.00,0.00,,
plausible analytics open source version site size limit,,0,0.00,,0.00,0.00,,
plausible analytics open startup revenue mrr 2025,,0,"0.00,0.00,0.00",,0.00,0.00,,
plausible analytics pricing $9 month,,0,"0.00,0.00",,0.00,0.00,,
plausible analytics pricing $9 per month,,0,"0.00,0.00",,0.00,0.00,,
plausible analytics pricing 10k pageviews,,0,0.00,,0.00,0.00,,
plausible analytics pricing 2025,,0,"0.00,0.00,0.00,0.00,0.00,0.00,0.00",,0.00,0.00,,
plausible analytics pricing free plan,,0,"0.00,0.00,0.00,0.00,0.00,1.00,1.00",,0.00,0.00,,
plausible analytics pricing pageviews,,0,"0.00,1.00,0.00",,0.00,0.00,,
plausible analytics privacy features,,0,0.00,,0.00,0.00,,
plausible analytics privacy focused open source,,0,0.00,,0.00,0.00,,
plausible analytics privacy focused web analytics,,0,0.00,,0.00,0.00,,
plausible analytics privacy friendly analytics,,0,0.00,,0.00,0.00,,
plausible analytics privacy friendly gdpr compliant,,0,0.00,,0.00,0.00,,
plausible analytics privacy friendly no cookies gdpr compliant,,0,0.00,,0.00,0.00,,
plausible analytics privacy friendly web analytics,,0,0.00,,0.00,0.00,,
plausible analytics privacy friendly website analytics,,0,0.00,,0.00,0.00,,
plausible analytics privacy-focused open source,,0,"0.00,0.00",,0.00,0.00,,
plausible analytics privacy-focused web analytics,,0,"0.00,0.00",,0.00,0.00,,
plausible analytics privacy-friendly analytics,,0,"0.00,0.00",,0.00,0.00,,
plausible analytics privacy-friendly no cookies gdpr compliant,,0,"0.00,0.00",,0.00,0.00,,
plausible analytics privacy-friendly open source,,0,0.00,,0.00,0.00,,
plausible analytics privacy-friendly web analytics,,0,"0.00,0.00",,0.00,0.00,,
plausible analytics privacy-friendly website analytics,,0,"0.00,0.00",,0.00,0.00,,
plausible analytics real time dashboard update frequency,,0,0.00,,0.00,0.00,,
plausible analytics real time dashboard update interval,,0,0.00,,0.00,0.00,,
plausible analytics realtime dashboard update frequency,,0,0.00,,0.00,0.00,,
plausible analytics realtime dashboard update interval,,0,0.00,,0.00,0.00,,
plausible analytics revenue 2024,,0,"0.00,0.00,0.00",,0.00,0.00,,
plausible analytics reviews,,0,"0.00,0.00,0.00,0.00,0.00,0.00,1.00,0.50,0.00,0.50,0.00,0.00",,0.00,0.33,,
plausible analytics self-hosted,,0,"0.00,0.00,0.00,0.00,0.00,0.00",,0.00,0.00,,
plausible analytics unique visitor identification method,,0,0.00,,0.00,0.00,,
plausible analytics unique visitors ip user-agent hash,,0,0.00,,0.00,0.00,,
plausible analytics unique visitors method ip ua,,0,0.00,,0.00,0.00,,
plausible analytics unique visitors method ip user agent,,0,0.00,,0.00,0.00,,
plausible analytics update november 2025,,0,"0.00,0.00,0.00",,0.00,0.00,,
plausible analytics updates news,,0,"0.00,0.00,0.00",,0.00,0.00,,
plausible analytics utm parameters documentation,,0,0.00,,0.00,0.00,,
plausible analytics vs,,0,"0.00,0.00,0.00,0.00,0.00,1.00,1.00,1.00,0.00,1.00,0.00,1.00",,0.00,0.00,,
plausible analytics vs google analytics comparison,,0,"1.00,0.00,0.00,0.00,0.00,0.00,0.00",,0.00,0.00,,
plausible for analytics,,0,"0.00,0.00,0.00,0.00,0.00,0.00,0.00,0.00,0.00,0.00,0.00,0.00",,0.00,0.00,,
plausible privacy analytics,,0,0.00,,0.00,0.00,,
plausible privacy-friendly analytics,,0,0.00,,0.00,0.00,,
