Keyword,Intent,Volume,Keyword Difficulty,CPC (USD),SERP Features
review pull request azure devops,,0,,0.00,
review pull request bitbucket,,0,,0.00,
review pull request in bitbucket,,0,,0.00,
review pull request in github,,0,,0.00,
review pull request in pycharm,,0,,0.00,
review pull request in visual studio 2017,,0,,0.00,
review pull request in visual studio 2022,,0,,0.00,
review pull request in vs code,,0,,0.00,
review pull request visual studio 2017,,0,,0.00,
review pull request visual studio code,,0,,0.00,
review pull requests,,0,,0.00,
review pull requests in visual studio,,0,,0.00,
reviewer recommendation for pull-requests in github,,0,,0.00,
reviewers on azure devops pull requests,,0,,0.00,
reviewing and accepting external pull requests,,0,,0.00,
reviewing pull request bitbucket,,0,,0.00,
reviewing pull requests locally,,0,,0.00,
reviewing your first pull request,,0,,0.00,
round robin reviewers on azure devops pull requests,,0,,0.00,
setup github code review without pull request,,0,,0.00,
sm-pull-request-reviewer,,0,,0.00,
smartgit review pull request,,0,,0.00,
sonar ai-powered code review automated pull request review,,0,,0.00,
specify people or teams allowed to dismiss pull request reviews.,,0,,0.00,
stacked pull request management tools reviews,,0,,0.00,
stash code review without pull request,,0,,0.00,
step by step video tfs git pull request and review,,0,,0.00,
submit review on pull request github,,0,,0.00,
submit review on pull request github user documentation,,0,,0.00,
submit reviews that affect a pull request's mergiability,,0,,0.00,
tfs git code review without pull request,,0,,0.00,
tfs git pull request code review,,0,,0.00,
tfs git pull request review wait for author,,0,,0.00,
tfs pull request code review,,0,,0.00,
tfs pull request default reviewers,,0,,0.00,
tfs pull request required reviewers,,0,,0.00,
tfs review pull request,,0,,0.00,
tfs review pull request in visual studio,,0,,0.00,
this file has not been reviewed in any pull request,,0,,0.00,
tool to review pull requests,,0,,0.00,
tools for pull request review in data projects,,0,,0.00,
top pull request review tools with ai-driven feedback,,0,,0.00,
track pull request pr review time,,0,,0.00,
update pull request after review,,0,,0.00,
upsource pull request review,,0,,0.00,
visual studio code review pull request,,0,,0.00,
vs code pull request review,,0,,0.00,
vscode copilot review pull request,,0,,0.00,
vsts disable reviewer field on pull requests,,0,,0.00,
vsts enforce who can review pull requests,,0,,0.00,
vsts git code review without pull request,,0,,0.00,
vsts pull request default reviewers,,0,,0.00,
webstorm review pull request,,0,,0.00,
what is a pull request review,,0,,0.00,
what is pull request pr review time,,0,,0.00,
what is pull request review,,0,,0.00,
workzone pull request reviewers bitbuckte addon,,0,,0.00,
write pull request review,,0,,0.00,
