Keyword,Intent,Volume,Keyword Difficulty,CPC (USD),SERP Features
github copilot pull request review,"Navigational, Commercial",70,36,4.42,"Sitelinks, AI Overview, Video, Video carousel, Related searches"
ai pull request review,Commercial,50,30,6.40,"Sitelinks, AI Overview, Video, Video carousel, Discussions and forums, Related searches"
github copilot review pull request,"Navigational, Commercial",50,36,4.71,"Sitelinks, Video, Video carousel, Related searches, Ads top"
github pull request review,Commercial,50,39,3.05,"Sitelinks, AI Overview, Video, Video carousel, Discussions and forums, Related searches, Ads top"
ai pull request review systems proprietary data privacy requirements,Commercial,40,12,0.00,"Sitelinks, AI Overview, Video, People also ask"
copilot review pull request,"Informational, Commercial",40,26,4.74,"Sitelinks, Video, Video carousel, Discussions and forums, Related searches, Ads top, Ads bottom"
github review pull request,"Informational, Commercial",40,39,3.05,"AI Overview, Video, Video carousel, People also ask, Discussions and forums, Related searches"
pull request code review best practices,Commercial,40,25,0.00,"Sitelinks, AI Overview, Video, Discussions and forums, Related searches"
pull request review,"Informational, Commercial",40,34,5.91,"Sitelinks, AI Overview, Video, Video carousel, People also ask, Discussions and forums, Related searches"
pull request review best practices,Commercial,40,23,0.00,"Sitelinks, AI Overview, Video, Discussions and forums, Related searches"
copilot pull request review,,30,,0.00,
cursor github pull request review,,30,,0.00,
pull request review copilot,,30,,0.00,
pull request review tool,,30,,3.52,
review pull request,"Informational, Commercial",30,35,5.08,"Sitelinks, AI Overview, Video, Video carousel, Related searches"
review pull request with github copilot,,30,,0.00,
using pull requests for code review,,30,,0.00,
add reviewer to pull request,,20,,0.00,
add reviewer to pull request bitbucket,,20,,0.00,
add reviewer to pull request github,,20,,0.00,
ai code review on pull requests,,20,,0.00,
ai to review pull requests,,20,,4.96,
azure devops add reviewer to pull request,,20,,0.00,
azure devops code review without pull request,,20,,0.00,
azure devops pull request reviewers,,20,,0.00,
azure devops review pull request,,20,,0.00,
best way to review pull requests,,20,,0.00,
bitbucket add reviewer to existing pull request,,20,,0.00,
bitbucket add reviewer to pull request,,20,,0.00,
bitbucket ai pull request review,,20,,0.00,
bitbucket code review without pull request,,20,,0.00,
bitbucket how to add reviewer to pull request,,20,,0.00,
bitbucket pull request reviewers,,20,,0.00,
bitbucket review pull request,,20,,0.00,
claude code review pull request,,20,,4.25,
code review vs pull request,,20,,0.00,
code review without pull request,,20,,0.00,
cursor pull request review,,20,,0.00,
cursor review pull request,,20,,0.00,
dismiss pull request reviews,,20,,0.00,
git add reviewer to pull request,,20,,0.00,
git code review pull request,,20,,0.00,
git pull request assignee vs reviewer,,20,,0.00,
git pull request code review,,20,,0.00,
git pull request review,,20,,0.00,
git review pull request,,20,,0.00,
github action pull_request_review,,20,,0.00,
github add pull request reviewer,,20,,0.00,
github add reviewer to pull request,,20,,0.00,
github ai pull request review,,20,,4.00,
github api pull request review,,20,,0.00,
github automatically add reviewers to pull request,,20,,0.00,
github code review pull request,,20,,0.00,
github code review without pull request,,20,,0.00,
github copilot code review pull request,,20,,6.93,
github copilot pull request reviews,,20,,0.00,
github desktop pull request review,,20,,0.00,
github desktop review pull request,,20,,0.00,
github filter pull requests by reviewer,,20,,0.00,
github how to review a pull request,,20,,0.00,
github how to review pull request,,20,,0.00,
github pull request add reviewer,,20,,0.00,
github pull request add single comment vs start a review,,20,,0.00,
github pull request ai review,,20,,4.07,
github pull request assign reviewer,,20,,0.00,
github pull request assignee vs reviewer,,20,,0.00,
github pull request automatic reviewers,,20,,0.00,
github pull request code review,,20,,0.00,
github pull request default reviewers,,20,,0.00,
github pull request multiple reviewers,,20,,0.00,
github pull request request review,,20,,0.00,
github pull request review ai,,20,,5.44,
github pull request review process,,20,,0.00,
github pull request review required,,20,,0.00,
github pull request review suggest changes,,20,,0.00,
github pull request review tool,,20,,3.01,
github pull request reviewer vs assignee,,20,,0.00,
github pull request start a review,,20,,0.00,
github remove reviewer from pull request,,20,,0.00,
github require pull request reviews before merging,,20,,0.00,
github require review for pull request,,20,,0.00,
github restrict who can dismiss pull request reviews,,20,,0.00,
github review own pull request,,20,,0.00,
github review pull request locally,,20,,0.00,
github review without pull request,,20,,0.00,
github review your own pull request,,20,,0.00,
github reviewing pull request,,20,,0.00,
github search pull requests by reviewer,,20,,0.00,
github update pull request after review,,20,,0.00,
how to add a reviewer to a pull request,,20,,0.00,
how to add reviewers in bitbucket pull request,,20,,0.00,
how to add reviewers in github pull request,,20,,0.00,
how to add reviewers to a pull request github,,20,,0.00,
how to add reviewers to github pull request,,20,,0.00,
how to make changes to pull request after review,,20,,0.00,
how to remove reviewer from pull request,,20,,0.00,
how to review a github pull request,,20,,0.00,
how to review a pull request,,20,,0.00,
how to review a pull request github,,20,,0.00,
how to review a pull request in github,,20,,0.00,
how to review and approve pull request in github,,20,,0.00,
how to review github pull request,,20,,0.00,
how to review pull request,,20,,0.00,
how to review pull request github,,20,,0.00,
how to review pull request in vscode,,20,,0.00,
intellij github pull request review,,20,,0.00,
intellij pull request review,,20,,0.00,
intellij review pull request,,20,,0.00,
merged a pull request without a review,,20,,0.00,
pull request add reviewer,,20,,0.00,
pull request assignee vs reviewer,,20,,0.00,
pull request code review,,20,,0.00,
pull request for code review,,20,,0.00,
pull request review ai,,20,,3.57,
pull request review checklist,,20,,0.00,
pull request review comments,,20,,0.00,
pull request review etiquette,,20,,0.00,
pull request review github,,20,,0.00,
pull request review guidelines,,20,,0.00,
pull request review meme,,20,,0.00,
pull request review process,,20,,0.00,
pull request reviewer vs assignee,,20,,0.00,
pull requests for code review,,20,,0.00,
pull_request_review,,20,,0.00,
pull_request_review github actions,,20,,0.00,
remove reviewer from pull request github,,20,,0.00,
require pull request reviews before merging,,20,,0.00,
require pull request reviews before merging github,,20,,0.00,
resolve conversation in a pull request review,,20,,0.00,
restrict who can dismiss pull request reviews,,20,,0.00,
review pull request github,,20,,0.00,
review pull request in intellij,,20,,0.00,
review pull request in visual studio,,20,,0.00,
review pull request in visual studio code,,20,,0.00,
review pull request in vscode,,20,,0.00,
reviewing a pull request,,20,,0.00,
visual studio 2022 pull request review,,20,,0.00,
visual studio pull request review,,20,,0.00,
visual studio review pull request,,20,,0.00,
vs code review pull request,,20,,0.00,
vscode pull request review,,20,,0.00,
vscode review pull request,,20,,0.00,
add a reviewer to a pull request,,10,,0.00,
add reviewer to github pull request,,10,,0.00,
add reviewers to pull request bitbucket,,10,,0.00,
ai code review pull request,,10,,0.00,
ai pull request review azure devops,,10,,0.00,
ai pull request review bitbucket,,10,,0.00,
ai pull request review github,,10,,0.00,
ai pull request reviewer,,10,,7.03,
ai review pull request,,10,,0.00,
automate security reviews code changes pull requests,,10,,0.00,
automated pull request review,,10,,0.00,
automated pull request review tools with intelligent suggestions,,10,,0.00,
best code review automation tools for pull request workflows,,10,,0.00,
bitbucket add reviewers to existing pull request,,10,,0.00,
bitbucket api pull request reviewers,,10,,0.00,
bitbucket pull request add reviewer,,10,,0.00,
bitbucket pull request code review,,10,,0.00,
bitbucket pull request review tools,,10,,0.00,
bitbucket pull request reviewers group,,10,,0.00,
bitbucket review without pull request,,10,,0.00,
claude code github pull request review,,10,,0.00,
claude code pull request review,,10,,6.32,
claude pull request review,,10,,6.66,
claude review pull request,,10,,0.00,
code review pull request,,10,,0.00,
compare ai-driven code review tools for pull requests,,10,,0.00,
continuous integration signals ai decide skip human review pull request,,10,,0.00,
cursor ai pull request review,,10,,0.00,
cursor bugbot github pull request review,,10,,0.00,
gemini pull request review,,10,,0.00,
git code review without pull request,,10,,0.00,
git pull request review process,,10,,0.00,
git review pull request command line,,10,,0.00,
github add reviewers to existing pull request,,10,,0.00,
github add reviewers to pull request,,10,,0.00,
github ai-powered code review automated pull request review,,10,,0.00,
github copilot pull request review instructions,,10,,0.00,
github pull request require review,,10,,0.00,
github pull request review copilot,,10,,0.00,
github pull request review workflow,,10,,0.00,
github pull request reviewers,,10,,4.74,
github pull request reviews,,10,,4.74,
heroku review apps pull requests,,10,,0.00,
how to add reviewer in pull request,,10,,0.00,
how to add reviewer to pull request,,10,,0.00,
how to add reviewer to pull request github,,10,,0.00,
how to add reviewers to pull request bitbucket,,10,,0.00,
how to add reviewers to pull request github,,10,,0.00,
how to review git pull request,,10,,0.00,
how to update a pull request after review,,10,,0.00,
how to update pull request after review,,10,,0.00,
machine learning predict contentious pull requests senior review,,10,,0.00,
pull request and code review,,10,,0.00,
pull request code review as a service,,10,,0.00,
pull request review prompt,,10,,0.00,
pull request reviews,,10,,5.08,
pycharm pull request review,,10,,0.00,
pycharm review pull request,,10,,0.00,
remove reviewer from pull request,,10,,0.00,
review github pull request,,10,,0.00,
review pull request github desktop,,10,,0.00,
review pull request locally,,10,,0.00,
reviewing pull requests,,10,,5.08,
rider pull request review,,10,,0.00,
sourcetree pull request review,,10,,0.00,
sourcetree review pull request,,10,,0.00,
visual studio 2022 review pull request,,10,,0.00,
vscode copilot pull request review,,10,,0.00,
add a review on pull request,,0,,0.00,
add reviewer pull request github,,0,,0.00,
add reviewer to open pull request,,0,,0.00,
add reviewer to pull request git,,0,,0.00,
add reviewers to commit message pull request bitbucket,,0,,0.00,
add reviewers to pull request,,0,,0.00,
add reviewers to pull request github,,0,,0.00,
add reviewers to pull request github after request is made,,0,,0.00,
adding reviewers to pull request bitbucket,,0,,0.00,
adding reviewers to pull request github,,0,,0.00,
ai code review for pull requests,,0,,0.00,
ai code review multi-language monorepo cross-service dependency pull request,,0,,0.00,
ai code review tools for pull requests,,0,,0.00,
ai for pull request review,,0,,0.00,
ai pull request feedback vs manual reviews developer burnout,,0,,0.00,
ai pull request review tool,,0,,0.00,
ai pull request review tools,,0,,0.00,
ai tools for pull request review,,0,,0.00,
ai-powered solutions for automated pull request reviews,,0,,0.00,
android studio review pull request,,0,,0.00,
atlassian pull request review,,0,,0.00,
atlassian stash pull request review,,0,,0.00,
atlassian stash pull request reviewers,,0,,0.00,
atom review pull request,,0,,0.00,
automate pull request review,,0,,0.00,
automated pull request review process implementation guide,,0,,0.00,
azure devops add required reviewer to pull request,,0,,0.00,
azure devops code review pull request,,0,,0.00,
azure devops pull request automatic reviewers,,0,,0.00,
azure devops pull request default reviewers,,0,,0.00,
azure devops review pull request in visual studio,,0,,0.00,
azure openai pull request review,,0,,0.00,
become reviewer for pull request,,0,,0.00,
best ai pull request reviewers for scaling engineering teams,,0,,0.00,
best practices for pull request reviews,,0,,0.00,
best practices for reviewing pull requests,,0,,0.00,
best pull request review platforms for small teams 2025,,0,,0.00,
best pull request review tools,,0,,0.00,
best pull request review tools for enterprise teams 2025,,0,,0.00,
best tools for automated code review in pull requests,,0,,0.00,
best tools for automated pull request review with intelligent suggestions,,0,,0.00,
best-rated code review automation tools with stacked pull request workflows,,0,,0.00,
best-rated pull request review tools for enterprise teams,,0,,0.00,
bitbucket add reviewer pull request,,0,,0.00,
bitbucket add reviewers to pull request,,0,,0.00,
bitbucket code review pull request,,0,,0.00,
bitbucket create code review without pull request,,0,,0.00,
bitbucket decline being a reviewer pull request,,0,,0.00,
bitbucket pull request auto reviewers,,0,,0.00,
bitbucket pull request change reviewer,,0,,0.00,
bitbucket pull request multiple reviewers,,0,,0.00,
bitbucket pull request no reviewers,,0,,0.00,
bitbucket pull request random reviewer,,0,,0.00,
bitbucket pull request required reviewer,,0,,0.00,
bitbucket pull request review,,0,,0.00,
bitbucket pull request review group,,0,,0.00,
bitbucket pull request review helper,,0,,0.00,
bitbucket pull request reviewer,,0,,0.00,
bitbucket pull request reviewers in commit message,,0,,0.00,
bitbucket remove reviewer from pull request,,0,,0.00,
bitbucket require pull request reviews before merging,,0,,0.00,
bitbucket reset api 1.0 pull requests reviewers list,,0,,0.00,
bitbucket rest api pull request reviewers,,0,,0.00,
bitbucket review a pull request,,0,,0.00,
bitbucket review own pull request,,0,,0.00,
bitbucket server pull request reviewers,,0,,0.00,
bitbucket server rest api to add reviewer to a pull-requests,,0,,0.00,
ci signals for ai engine pull request review,,0,,0.00,
code review analytics tools pull request cycle tracking,,0,,0.00,
code review automation tools for reducing pull request cycle times,,0,,0.00,
code review software with advanced pull request features,,0,,0.00,
codeball ai pull request review,,0,,0.00,
codecommit pull request review,,0,,0.00,
codecommit pull request reviewer,,0,,0.00,
codecommit pull request reviewers,,0,,0.00,
codiumai pr-agent github action review pull requests,,0,,0.00,
codiumai pr-agent github app review pull requests,,0,,0.00,
correct approach to pull request review,,0,,0.00,
create pull request for code review,,0,,0.00,
crucible pull request review,,0,,0.00,
cursor ai code review pull request,,0,,0.00,
cursor bugbot pull request review,,0,,0.00,
data quality tools for dbt pull request reviews,,0,,0.00,
development peer review pull request,,0,,0.00,
difference between pull request and code review,,0,,0.00,
differences between crucible reviews and pull requests,,0,,0.00,
do you have to review every commit for pull request,,0,,0.00,
effective pull request reviews,,0,,0.00,
enterprise solutions for scaling automated pull request reviews,,0,,0.00,
expose review environments to stakeholders on every pull request,,0,,0.00,
gemini code assist pull request review,,0,,0.00,
gerrit code review vs pull request,,0,,0.00,
getting erro 404 during pull request review,,0,,0.00,
git command line review pull request,,0,,0.00,
git how to do a pull request review,,0,,0.00,
git how to review a pull request,,0,,0.00,
git how to verify a pull request review,,0,,0.00,
git hub how to require reviews on pull requests,,0,,0.00,
git hub pull request a review,,0,,0.00,
git i want to review a pull request,,0,,0.00,
git pull request add reviewer,,0,,0.00,
git pull request and review,,0,,0.00,
git pull request code review tools,,0,,0.00,
git pull request review approve review,,0,,0.00,
git pull request review command line,,0,,0.00,
git pull request review in visual studio,,0,,0.00,
git pull request review tools,,0,,0.00,
git pull request tutorial and review,,0,,0.00,
git request branch review without pull request,,0,,0.00,
git review pull request from other fork command line,,0,,0.00,
git review pull request locally,,0,,0.00,
git start code review from pull request,,0,,0.00,
git submiting a pull request for review,,0,,0.00,
git using pull requests for code review,,0,,0.00,
gitea pull request review,,0,,0.00,
gitea review approve your own pull request,,0,,0.00,
github actions pull_request_review,,0,,0.00,
github add review to pull request,,0,,0.00,
github api review pull request,,0,,0.00,
github cannot add reviewers to pull request,,0,,0.00,
github cannot assign reviewer pull request,,0,,0.00,
github checkout a pull request to review,,0,,0.00,
github code review outside of pull request,,0,,0.00,
github copilot code reviews pull requests,,0,,0.00,
github copilot pull request code review,,0,,0.00,
github copilot pull request reviewer,,0,,0.00,
github copilot review pull request vscode,,0,,0.00,
github create pull request command line for peer review,,0,,0.00,
github create pull request with reviewers,,0,,0.00,
github make pull request review,,0,,0.00,
github merge pull request without review,,0,,0.00,
github pull request ask for review again,,0,,0.00,
github pull request assignee reviewer,,0,,0.00,
github pull request difference between reviewer and assignee,,0,,0.00,
github pull request how to add reviewer,,0,,0.00,
github pull request re review,,0,,0.00,
github pull request remove reviewer,,0,,0.00,
github pull request review api,,0,,0.00,
github pull request review approve,,0,,0.00,
github pull request review changes,,0,,0.00,
github pull request review edit someone else's,,0,,0.00,
github pull request review ignore whitespace,,0,,0.00,
github pull request review multiple lines,,0,,0.00,
github pull request review request,,0,,0.00,
github pull request review request changes,,0,,0.00,
github pull request review webhook,,0,,0.00,
github pull request reviewer,,0,,4.74,
github pull request reviewer group,,0,,0.00,
github pull request reviewer status,,0,,0.00,
github pull request reviewers vs assignees,,0,,0.00,
github pull request search reviewer,,0,,0.00,
github pull request self review,,0,,0.00,
github pull request template reviewers,,0,,0.00,
github pull_request_review_comment,,0,,0.00,
github request review without pull request,,0,,0.00,
github requesting a pull request review cli,,0,,0.00,
github require pull request without review,,0,,0.00,
github review my own pull request,,0,,0.00,
github review pull request dashboard,,0,,0.00,
github review pull request from other fork,,0,,0.00,
github review pull requests,,0,,0.00,
github reviewing pull request delete file,,0,,0.00,
github show reviewers in pull request table,,0,,0.00,
gitkraken pull request review,,0,,0.00,
gitkraken review pull request,,0,,0.00,
gitlab add reviewer to pull request,,0,,0.00,
gitlab how to add reviewers to pull request,,0,,0.00,
gitlab pull request code review,,0,,0.00,
gitlab pull request review,,0,,0.00,
gogs pull request review,,0,,0.00,
good pull request review tool for github,,0,,0.00,
heroku review apps github pull requests,,0,,0.00,
heroku review apps pull requests documentation,,0,,0.00,
how can i ensure my pull request gets reviewed promptly,,0,,0.00,
how can i ensure my pull request gets reviewed quickly,,0,,0.00,
how can i ensure my pull request is reviewed efficiently,,0,,0.00,
how can i ensure my pull request is reviewed promptly,,0,,0.00,
how do i add reviewers to my bitbucket pull request,,0,,0.00,
how quickly should i review pull requests,,0,,0.00,
how to add reviewer in azure devops pull request,,0,,0.00,
how to add reviewer in github pull request,,0,,0.00,
how to add reviewers after creating pull request github,,0,,0.00,
how to add reviewers to pull request,,0,,0.00,
how to do code reviews using pull requests,,0,,0.00,
how to do pull request review,,0,,0.00,
how to have github pull request auto add reviewer,,0,,0.00,
how to measure pull request pr review time,,0,,0.00,
how to reduce pull request pr review time,,0,,0.00,
how to request a review to my pull request,,0,,0.00,
how to request a review to my pull requet,,0,,0.00,
how to require code reviews on pull requests,,0,,0.00,
how to review a pull request best practices,,0,,0.00,
how to review a pull request in visual studio code,,0,,0.00,
how to review and test drive a git pull request,,0,,0.00,
how to review issue on github no pull request,,0,,0.00,
how to review new commits to a pull request,,0,,0.00,
how to review pull request bitbucket,,0,,0.00,
how to review pull request in visual studio,,0,,0.00,
how to review pull request locally,,0,,0.00,
how to review pull requests,,0,,0.00,
how to setup copilot as pull request reviewer,,0,,0.00,
how to speed up pull request reviews,,0,,0.00,
how to use github copilot to review pull request,,0,,0.00,
https blog.scottnonnenberg.com top-ten-pull-request-review-mistakes,,0,,0.00,
hub pull-request reviewer,,0,,0.00,
hub pull-request reviewers,,0,,0.00,
in azure pull request where to set default reviewers,,0,,0.00,
intellij bitbucket pull request review,,0,,0.00,
intellij code review pull request,,0,,0.00,
intellij idea review pull request,,0,,0.00,
intellij review pull request bitbucket,,0,,0.00,
list reviews on a pull request example,,0,,0.00,
make changes to code pull request review,,0,,0.00,
marked this pull request as ready for review,,0,,0.00,
me reviewing pull requests,,0,,0.00,
merged a pull request without code review,,0,,0.00,
merged pull request without code review,,0,,0.00,
neovim github pull request review 2025,,0,,0.00,
not part of a pull request or review,,0,,0.00,
online reviews of pull request review and code quality tools,,0,,0.00,
optimize pull request pr review time,,0,,0.00,
peer review equals pull request,,0,,0.00,
peer review pull request,,0,,0.00,
peer review vs pull request,,0,,0.00,
phpstorm review pull request,,0,,0.00,
platforms offering ai-driven code reviews for stacked pull requests,,0,,0.00,
platforms to streamline pull request reviews and approvals,,0,,0.00,
please review my pull request,,0,,0.00,
pragmatic pull request review,,0,,0.00,
pull down pull request to review,,0,,0.00,
pull request add reviewer no write permission,,0,,0.00,
pull request ai review news,,0,,0.00,
pull request approval process ensure reviews are thorough,,0,,0.00,
pull request assign vs review,,0,,0.00,
pull request assignee vs reviewers,,0,,0.00,
pull request automation tools reviews and pricing comparisons,,0,,0.00,
pull request code review github,,0,,0.00,
pull request code review process,,0,,0.00,
pull request code review service,,0,,0.00,
pull request for code review visual studio,,0,,0.00,
pull request force-with-lease reviewable,,0,,0.00,
pull request management software with ai-driven code review capabilities,,0,,0.00,
pull request no reviewer,,0,,0.00,
pull request peer review,,0,,0.00,
pull request pr review time benchmark,,0,,0.00,
pull request pr review time best practices,,0,,0.00,
pull request pr review time kpi,,0,,0.00,
pull request pr review time metric,,0,,0.00,
pull request pr review time trends,,0,,0.00,
pull request ready for review,,0,,0.00,
pull request request review,,0,,0.00,
pull request review agent,,0,,0.00,
pull request review as a service,,0,,0.00,
pull request review automation,,0,,0.00,
pull request review bitbucket,,0,,0.00,
pull request review bot,,0,,0.00,
pull request review comment,,0,,0.00,
pull request review git,,0,,0.00,
pull request review latency,,0,,0.00,
pull request review reminder,,0,,0.00,
pull request review standards,,0,,0.00,
pull request review tools,,0,,3.52,
pull request review tools with analytics and metrics,,0,,0.00,
pull request review tools with built-in analytics and metrics,,0,,0.00,
pull request reviewer,,0,,5.08,
pull request reviewer pay,,0,,0.00,
pull request reviewers,,0,,5.08,
pull request reviewers job,,0,,0.00,
pull request reviews as a service,,0,,0.00,
pull request reviews command line,,0,,0.00,
pull request vs code review,,0,,0.00,
pull request vs peer review,,0,,0.00,
pull requests and code review,,0,,0.00,
pull requests and code review github,,0,,0.00,
pull requests review dashboard,,0,,0.00,
pull review request,,0,,0.00,
pull stack paper machine pull_request_review_comment,,0,,0.00,
pull_request_review_comment,,0,,0.00,
remove default vsts pull request reviewer,,0,,0.00,
remove myself as pull request reviewer,,0,,0.00,
replit pull request review ai replit code review,,0,,0.00,
request pull request review,,0,,0.00,
requested your review on this pull request,,0,,0.00,
requested your review on this pull request.,,0,,0.00,
requesting a pull request review,,0,,0.00,
require pull request reviews before merging bitbucket,,0,,0.00,
require pull request reviews github enterprise,,0,,0.00,
require user to review pull request visual studio team services,,0,,0.00,
required reviewer vsts pull request,,0,,0.00,
required_pull_request_reviews,,0,,0.00,
rest api to add reviewer to a pull-requests,,0,,0.00,
resubmit pull request after review changes,,0,,0.00,
review a pull request,,0,,0.00,
review a pull request github,,0,,0.00,
review a pull request locally visual studio code,,0,,0.00,
review assistant pull request,,0,,0.00,
review before pull request,,0,,0.00,
review board pull request,,0,,0.00,
review board vs github pull request,,0,,0.00,
review git pull request in vscode,,0,,0.00,
review ninja pull request,,0,,0.00,
review pull request after the fact,,0,,0.00,
